{
 "channel": "body-cast",
 "episode": "stomach-acid",
 "series": "day_in_life",
 "working_title": "Why doesn't your stomach digest itself?",
 "lead_in": 0.3,
 "tail": 0.8,
 "gap": 0.3,
 "paras": [
  {
   "id": "hook",
   "say": "Your stomach acid can dissolve zinc. So why not your stomach?",
   "kind": "hook",
   "claims": [
    "c_zinc"
   ],
   "gap": 0.4,
   "caps": [
    [
     "YOUR STOMACH ACID",
     3
    ],
    [
     "CAN DISSOLVE ZINC.",
     3
    ],
    [
     "SO WHY NOT",
     3
    ],
    [
     "YOUR STOMACH?",
     2
    ]
   ],
   "speaker": "narrator"
  },
  {
   "id": "ask",
   "say": "Honestly? I ask myself that every day.",
   "kind": "joke",
   "claims": [],
   "gap": 0.4,
   "caps": [
    [
     "HONESTLY?",
     1
    ],
    [
     "I ASK MYSELF THAT",
     4
    ],
    [
     "EVERY DAY.",
     2
    ]
   ],
   "speaker": "stomach"
  },
  {
   "id": "mucus",
   "say": "The lining coats itself in thick mucus, laced with bicarbonate, a base that fights the acid.",
   "kind": "fact",
   "claims": [
    "c_mucus"
   ],
   "gap": 0.3,
   "caps": [
    [
     "THE LINING COATS ITSELF",
     4
    ],
    [
     "IN THICK MUCUS,",
     3
    ],
    [
     "LACED WITH BICARBONATE,",
     3
    ],
    [
     "A BASE THAT FIGHTS",
     4
    ],
    [
     "THE ACID.",
     2
    ]
   ],
   "speaker": "narrator"
  },
  {
   "id": "coat",
   "say": "Basically, I wear a raincoat. Made of snot.",
   "kind": "joke",
   "claims": [
    "c_mucus"
   ],
   "gap": 0.45,
   "caps": [
    [
     "BASICALLY,",
     1
    ],
    [
     "I WEAR A RAINCOAT.",
     4
    ],
    [
     "MADE OF SNOT.",
     3
    ]
   ],
   "speaker": "stomach"
  },
  {
   "id": "turn",
   "say": "But one bacterium corkscrews straight into the mucus.",
   "kind": "fact",
   "claims": [
    "c_hp"
   ],
   "gap": 0.3,
   "caps": [
    [
     "BUT ONE BACTERIUM",
     3
    ],
    [
     "CORKSCREWS STRAIGHT",
     2
    ],
    [
     "INTO THE MUCUS.",
     3
    ]
   ],
   "speaker": "narrator"
  },
  {
   "id": "hi",
   "say": "Hello. Helicobacter. About half of you have me.",
   "kind": "joke",
   "claims": [
    "c_half"
   ],
   "gap": 0.45,
   "caps": [
    [
     "HELLO. HELICOBACTER.",
     2
    ],
    [
     "ABOUT HALF OF YOU",
     4
    ],
    [
     "HAVE ME.",
     2
    ]
   ],
   "speaker": "gut_microbes"
  },
  {
   "id": "blame",
   "say": "For decades, doctors blamed ulcers on stress and spicy food.",
   "kind": "fact",
   "claims": [
    "c_doctrine"
   ],
   "gap": 0.3,
   "caps": [
    [
     "FOR DECADES,",
     2
    ],
    [
     "DOCTORS BLAMED ULCERS",
     3
    ],
    [
     "ON STRESS",
     2
    ],
    [
     "AND SPICY FOOD.",
     3
    ]
   ],
   "speaker": "narrator"
  },
  {
   "id": "drank",
   "say": "So in nineteen eighty-four, a doctor named Barry Marshall drank a beaker of it.",
   "kind": "fact",
   "claims": [
    "c_drank"
   ],
   "gap": 0.3,
   "caps": [
    [
     "SO IN 1984,",
     4
    ],
    [
     "A DOCTOR NAMED",
     3
    ],
    [
     "BARRY MARSHALL",
     2
    ],
    [
     "DRANK A BEAKER OF IT.",
     5
    ]
   ],
   "speaker": "narrator"
  },
  {
   "id": "sick",
   "say": "Three days later he felt sick. His wife noticed his breath.",
   "kind": "fact",
   "claims": [
    "c_sick"
   ],
   "gap": 0.4,
   "caps": [
    [
     "THREE DAYS LATER",
     3
    ],
    [
     "HE FELT SICK.",
     3
    ],
    [
     "HIS WIFE NOTICED",
     3
    ],
    [
     "HIS BREATH.",
     2
    ]
   ],
   "speaker": "narrator"
  },
  {
   "id": "nobel",
   "say": "He was right. In two thousand five, he won the Nobel Prize.",
   "kind": "fact",
   "claims": [
    "c_nobel"
   ],
   "gap": 0.45,
   "caps": [
    [
     "HE WAS RIGHT.",
     3
    ],
    [
     "IN 2005,",
     4
    ],
    [
     "HE WON",
     2
    ],
    [
     "THE NOBEL PRIZE.",
     3
    ]
   ],
   "speaker": "narrator"
  },
  {
   "id": "toll",
   "say": "Acid strong enough for zinc. Stopped by snot. Mostly.",
   "kind": "callback",
   "claims": [
    "c_zinc",
    "c_mucus"
   ],
   "gap": 0.0,
   "caps": [
    [
     "ACID STRONG ENOUGH",
     3
    ],
    [
     "FOR ZINC.",
     2
    ],
    [
     "STOPPED BY SNOT.",
     3
    ],
    [
     "MOSTLY.",
     1
    ]
   ],
   "speaker": "narrator"
  }
 ],
 "loop": {
  "last": "toll",
  "connects_to": "hook",
  "how": "Ends on the acid and zinc the hook named; the last frame is the stomach in its raincoat with the microbe peeking out."
 }
}